{
  "$schema": "scenario@1",
  "id": "sample.fighter_goblin_surprise",
  "seed": 1,
  "pack": "sample.vertical_slice",
  "board": {
    "map": {}
  },
  "party": [
    {"id": "fighter", "archetype": "srd51.character.fighter_1", "tile": {"x": 8, "y": 8}}
  ],
  "monsters": [
    {"id": "goblin", "archetype": "srd51.monster.goblin", "tile": {"x": 9, "y": 8}}
  ],
  "surprise": ["goblin"],
  "end_condition": "teams",
  "round_cap": 20
}
